{
  "id": "inchon_1950",
  "name": "인천상륙작전",
  "name_en": "Battle of Inchon · Op. Chromite",
  "era": "korean_war",
  "year": 1950,
  "year_decimal": 1950.71,
  "date_display": "1950년 9월 15일",
  "coords": [
    37.452,
    126.598
  ],
  "sides": [
    {
      "name": "유엔군 (미 10군단)",
      "commander": "맥아더 · 알몬드",
      "troops": 75000,
      "casualties": 222,
      "color": "un",
      "victor": true,
      "symbol": "amphibious"
    },
    {
      "name": "인민군 수비대",
      "commander": "월미도 수비대 · 인천 226연대",
      "troops": 6500,
      "casualties": 2700,
      "color": "kpa",
      "victor": false,
      "symbol": "infantry"
    }
  ],
  "tactics": [
    {
      "ko": "전략적 우회",
      "en": "Strategic Envelopment",
      "desc": "낙동강 정면 돌파 대신 후방 상륙으로 보급선·후퇴로 차단"
    },
    {
      "ko": "상륙작전",
      "en": "Amphibious Assault",
      "desc": "평균 9m 조수간만차, 좁은 수로, 갯벌의 3중 악조건을 기습 요소로 활용"
    },
    {
      "ko": "기만작전",
      "en": "Deception",
      "desc": "군산·삼척 양동 상륙 시늉으로 적 예비대 분산"
    }
  ],
  "significance": "<strong>군사사상 가장 대담한 작전 중 하나.</strong> 합참 다수가 \"성공 확률 5000:1\"이라 반대했음에도 맥아더 강행. 성공 한 번으로 전쟁의 양상을 완전히 뒤집었다.",
  "description": "인천은 조수간만차 평균 9m, 좁은 비어수도, 갯벌이라 단 몇 시간만 상륙 가능했다. 맥아더는 정확히 이 \"불가능성\" 때문에 적이 방심하리라 판단. 9월 15일 새벽 월미도 점령, 저녁 인천 시가지 진입. 11일 만에 서울 탈환. 인민군 주력은 낙동강에서 보급이 끊겨 와해.",
  "influenced_by": [
    "france_1940",
    "nakdong_1950"
  ],
  "influences": [],
  "has_simulation": true,
  "sources": [
    {
      "type": "book",
      "citation": "Heinl, R. (1968). Victory at High Tide: The Inchon-Seoul Campaign. Lippincott."
    },
    {
      "type": "book",
      "citation": "국방부 군사편찬연구소 (2005). 6·25전쟁사 4권: 금강-소백산맥선 지연작전."
    }
  ],
  "wikidata_id": "Q186347",
  "wikipedia": {
    "ko": "https://ko.wikipedia.org/wiki/인천_상륙_작전",
    "en": "https://en.wikipedia.org/wiki/Battle_of_Inchon"
  },
  "contributors": [],
  "last_reviewed": null,
  "review_status": "community"
}