{
  "id": "tannenberg_1914",
  "name": "타넨베르크 전투",
  "name_en": "Battle of Tannenberg",
  "era": "ww1",
  "year": 1914,
  "year_decimal": 1914.65,
  "date_display": "1914년 8월 26-30일",
  "coords": [
    53.498,
    20.135
  ],
  "sides": [
    {
      "name": "독일 제국",
      "commander": "힌덴부르크 · 루덴도르프",
      "troops": 150000,
      "casualties": 13900,
      "color": "german",
      "victor": true,
      "symbol": "infantry_combined"
    },
    {
      "name": "러시아 제국 (2군)",
      "commander": "삼소노프",
      "troops": 230000,
      "casualties": 170000,
      "color": "russian",
      "victor": false,
      "symbol": "infantry"
    }
  ],
  "tactics": [
    {
      "ko": "내선기동",
      "en": "Interior Lines",
      "desc": "철도로 한쪽 적을 무시하고 다른 쪽에 전력 집중"
    },
    {
      "ko": "쌍익포위",
      "en": "Double Envelopment",
      "desc": "러시아 2군의 양 측면을 동시에 우회"
    },
    {
      "ko": "신호정보 활용",
      "en": "SIGINT Exploitation",
      "desc": "평문 무선 전문 도청으로 적 의도 사전 파악"
    }
  ],
  "significance": "<strong>현대전에서 부활한 칸나이.</strong> 한니발 이후 2100년 만에 쌍익포위 완전 재현. <strong>철도 기반 내선기동</strong>의 첫 대규모 성공이자 무선 도청(SIGINT)이 작전을 결정한 최초의 전투.",
  "description": "러시아 1군(렌넨캄프)과 2군(삼소노프)이 동프로이센으로 동시 진격했으나 50km 이상 벌어졌다. 힌덴부르크-루덴도르프는 렌넨캄프 앞에 소수만 남기고 철도로 전 병력을 남쪽으로 이동시켜 삼소노프의 양 측면을 동시 우회. 러시아군의 평문 통신 도청이 결정적이었다.",
  "influenced_by": [],
  "influences": [
    "france_1940"
  ],
  "has_simulation": true,
  "sources": [
    {
      "type": "book",
      "citation": "Showalter, D. (2004). Tannenberg: Clash of Empires, 1914. Brassey's."
    },
    {
      "type": "book",
      "citation": "Tuchman, B. (1962). The Guns of August. Macmillan."
    }
  ],
  "wikidata_id": "Q156534",
  "wikipedia": {
    "ko": "https://ko.wikipedia.org/wiki/타넨베르크_전투_(1914년)",
    "en": "https://en.wikipedia.org/wiki/Battle_of_Tannenberg"
  },
  "contributors": [],
  "last_reviewed": null,
  "review_status": "community"
}
